program_id,course_title,url,num_learning_objectives,num_modules,num_module_contents,coverage_percentage,mean_max_similarity,num_los,num_covered_los
359,Building Your Career in Music: Developing A Brand and Funding Your Music,https://www.coursera.org/learn/navigate-music-industry-independent-artist,8,12,48,75.0,0.6205847427248955,16.0,12.0
360,Risk Management in Personal Finance,https://www.coursera.org/learn/risk-management-in-personal-finance,1,4,15,0.0,0.4101096123456955,1.0,0.0
360,Managing Debt,https://www.coursera.org/learn/managing-debt,7,4,38,85.71428571428571,0.602119071994509,7.0,6.0
360,Fundamentals of Investing,https://www.coursera.org/learn/investing-fundamentals,11,4,27,63.63636363636363,0.5604739432985132,11.0,7.0
360,Saving Money for the Future,https://www.coursera.org/learn/saving-money-future,1,4,34,0.0,0.393753707408905,1.0,0.0
360,Introduction to Personal Finance,https://www.coursera.org/learn/personal-finance-introduction,1,4,53,100.0,0.5828775465488434,1.0,1.0
361,ESG Risks and Opportunities,https://www.coursera.org/learn/esg-risks-opportunities,8,4,30,12.5,0.4080903388559818,8.0,1.0
361,ESG and Social Activism,https://www.coursera.org/learn/esg-social-activism,8,4,23,50.0,0.5199481714516878,8.0,4.0
361,ESG Impact: Investor Perspective,https://www.coursera.org/learn/esg-impact-investor-perspective,6,4,21,33.33333333333333,0.40821237365404767,6.0,2.0
361,ESG and Climate Change,https://www.coursera.org/learn/esg-and-climate-change,6,4,17,16.666666666666664,0.4382161716620127,6.0,1.0
362,Consonants of American English Pronunciation,https://www.coursera.org/learn/american-english-pronunciation-consonant-sounds,6,5,43,50.0,0.5255568537861108,6.0,3.0
362,Vowels of American English Pronunciation,https://www.coursera.org/learn/american-english-pronunciation-vowel-sounds,7,5,43,57.14285714285714,0.57201269865036,7.0,4.0
362,The Music of American English Pronunciation,https://www.coursera.org/learn/american-english-pronunciation-music,1,5,45,0.0,0.4240353107452392,1.0,0.0
362,The Pronunciation of American English Project,https://www.coursera.org/learn/pronunciation-american-english-project,5,5,16,60.0,0.5707109612226485,5.0,3.0
363,Songwriting: Writing the Lyrics,https://www.coursera.org/learn/songwriting-lyrics,4,15,114,75.0,0.5612771309912205,12.0,9.0
363,Singing Popular Music,https://www.coursera.org/learn/singing-popular-music,4,5,21,100.0,0.6362723290920258,4.0,4.0
363,Guitar for Beginners,https://www.coursera.org/learn/guitar,5,14,78,60.0,0.511883200109005,10.0,6.0
363,Introduction to Ableton Live,https://www.coursera.org/learn/ableton-live,4,12,96,100.0,0.6763308145105839,12.0,12.0
364,Accounting: Principles of Financial Accounting,https://www.coursera.org/learn/financial-accounting,1,8,92,91.66666666666666,0.6905129907031854,12.0,11.0
364,Corporate Finance Essentials,https://www.coursera.org/learn/corporate-finance-essentials,2,8,43,50.0,0.548894202709198,2.0,1.0
364,Corporate Finance Essentials II,https://www.coursera.org/learn/corporate-finance-essentials-ii,6,6,51,50.0,0.5435139772792658,6.0,3.0
364,Finance for Managers,https://www.coursera.org/learn/operational-finance,2,8,118,72.72727272727273,0.5407772321592679,22.0,16.0
365,Advanced Trading Algorithms,https://www.coursera.org/learn/advanced-trading-algorithms,6,4,22,50.0,0.45359918326139453,6.0,3.0
365,Design your own trading strategy – Culminating Project,https://www.coursera.org/learn/design-trading-strategy-culminating-project,2,6,18,0.0,0.48033037781715393,2.0,0.0
365,Creating a Portfolio ,https://www.coursera.org/learn/investment-portfolio,2,4,30,100.0,0.6358721882104874,2.0,2.0
365,Trading Algorithms,https://www.coursera.org/learn/trading-algorithm,6,4,15,16.666666666666664,0.34953331773479784,6.0,1.0
365,Trading Basics,https://www.coursera.org/learn/trading-basics,4,4,37,100.0,0.6480658978223801,4.0,4.0
366,Taxation of Business Entities II: Pass-Through Entities,https://www.coursera.org/learn/taxation-business-entities-part-2,5,9,156,80.0,0.6053849226236343,5.0,4.0
366,Taxation of Business Entities I: Corporations,https://www.coursera.org/learn/taxation-business-entities-part-1,9,9,177,44.44444444444444,0.5207541988955603,9.0,4.0
366,"Federal Taxation I: Individuals, Employees, and Sole Proprietors",https://www.coursera.org/learn/federal-taxation-individuals,9,9,63,55.55555555555556,0.5421647033757632,9.0,5.0
366,Federal Taxation II: Property Transactions of Business Owners and Shareholders,https://www.coursera.org/learn/federal-taxation-business,5,9,51,80.0,0.6796350014209748,5.0,4.0
367,Visual Elements of User Interface Design,https://www.coursera.org/learn/visual-elements-user-interface-design,8,5,39,62.5,0.5250490689650178,8.0,5.0
367,UX Design Fundamentals,https://www.coursera.org/learn/ux-design-fundamentals,8,5,39,25.0,0.47371117025613785,8.0,2.0
367,Web Design: Strategy and Information Architecture,https://www.coursera.org/learn/web-design-strategy,9,5,40,33.33333333333333,0.4718865033653047,9.0,3.0
367,Web Design: Wireframes to Prototypes,https://www.coursera.org/learn/web-design-wireframes-prototypes,9,5,45,55.55555555555556,0.48825423353248165,9.0,5.0
368,"Uncommon Sense Teaching: Part 2, Building Community and Habits of Learning",https://www.coursera.org/learn/building-community-habits-of-learning,1,4,34,0.0,0.4170392453670501,1.0,0.0
368,Uncommon Sense Teaching: Teaching Online,https://www.coursera.org/learn/teaching-online,21,4,39,38.095238095238095,0.47170547885554176,21.0,8.0
368,Uncommon Sense Teaching,https://www.coursera.org/learn/uncommon-sense-teaching,1,4,37,100.0,0.5683323204517364,1.0,1.0
369,Introduction to User Experience Principles and Processes,https://www.coursera.org/learn/introtoux-principles-and-processes,8,6,31,87.5,0.6391332225874067,8.0,7.0
369,"UX Research at Scale: Surveys, Analytics, Online Testing",https://www.coursera.org/learn/ux-research-at-scale,6,8,45,66.66666666666666,0.5287885045011838,6.0,4.0
369,UX (User Experience) Capstone,https://www.coursera.org/learn/user-experience-capstone,7,6,13,0.0,0.340060357110841,7.0,0.0
369,Evaluating Designs with Users,https://www.coursera.org/learn/evaluating-designs-with-users,6,5,15,50.0,0.577561387916406,6.0,3.0
369,Understanding User Needs,https://www.coursera.org/learn/understanding-user-needs,11,5,15,36.36363636363637,0.46271889114921744,11.0,4.0
369,UX Design: From Concept to Prototype,https://www.coursera.org/learn/ux-design-concept-wireframe,6,6,24,66.66666666666666,0.5782589231928189,6.0,4.0
370,Prototyping and Design,https://www.coursera.org/learn/prototyping-design,5,5,34,60.0,0.5337590372562409,5.0,3.0
370,Introduction to UI Design,https://www.coursera.org/learn/ui-design,3,4,35,33.33333333333333,0.48417539199193316,3.0,1.0
370,Evaluating User Interfaces,https://www.coursera.org/learn/ui-testing,4,7,35,50.0,0.5266805209219456,4.0,2.0
370,User Research and Design,https://www.coursera.org/learn/design-research,4,5,25,50.0,0.536491984128952,4.0,2.0
371,Operations Management: Organization and Analysis,https://www.coursera.org/learn/operations-management-organization-and-analysis,4,4,38,100.0,0.694310998916626,4.0,4.0
371,Developing a Winning Marketing Strategy,https://www.coursera.org/learn/marketing-management,9,5,56,66.66666666666666,0.6034799799323083,9.0,6.0
371,Operations Management: Quality and Supply Chain,https://www.coursera.org/learn/operations-management-quality-and-supply-chain,4,5,38,75.0,0.6324829742312431,4.0,3.0
371,"Managerial Accounting: Cost Behaviors, Systems, and Analysis",https://www.coursera.org/learn/accounting-for-managers,7,4,36,71.42857142857143,0.5655490687915256,7.0,5.0
371,Managerial Accounting: Tools for Facilitating and Guiding Business Decisions,https://www.coursera.org/learn/managerial-accounting-business-decisions,8,4,70,75.0,0.5697933044284582,8.0,6.0
371,Developing a Marketing Mix for Growth,https://www.coursera.org/learn/marketing-management-two,12,5,38,66.66666666666666,0.5501602114488681,12.0,8.0
372,Value-Based Care: Introduction to Value-Based Care and the U.S. Healthcare System,https://www.coursera.org/learn/value-based-care-introduction,3,4,41,100.0,0.7783654123544693,3.0,3.0
372,Value-Based Care: Capstone Project,https://www.coursera.org/learn/value-based-care-capstone,6,4,18,33.33333333333333,0.5039050139486789,6.0,2.0
372,Value-Based Care: Population Health,https://www.coursera.org/learn/pop-health,3,3,27,100.0,0.8155634562174479,3.0,3.0
372,Value-Based Care: Managing Processes to Improve Outcomes,https://www.coursera.org/learn/managing-processes,4,3,33,100.0,0.6215340003371239,4.0,4.0
372,Value-Based Care: Quality Improvement in Organizations,https://www.coursera.org/learn/value-based-care-quality-improvement-in-organizations,3,3,25,100.0,0.6075817565123239,3.0,3.0
372,Value-Based Care: Reimbursement Models,https://www.coursera.org/learn/reimburse-models,3,3,26,100.0,0.8150076866149902,3.0,3.0
372,Value-Based Care: Organizational Competencies,https://www.coursera.org/learn/value-based-care-organizational-competencies,10,3,25,80.0,0.653904780447483,10.0,8.0
373,Building Database Applications in PHP,https://www.coursera.org/learn/database-applications-php,3,5,38,66.66666666666666,0.5544022093216578,3.0,2.0
373,Building Web Applications in PHP,https://www.coursera.org/learn/web-applications-php,3,8,50,33.33333333333333,0.5207732250293096,3.0,1.0
373,Introduction to Structured Query Language (SQL),https://www.coursera.org/learn/intro-sql,2,4,19,100.0,0.5991094440221787,2.0,2.0
373,"JavaScript, jQuery, and JSON",https://www.coursera.org/learn/javascript-jquery-json,3,4,37,100.0,0.7738903572161991,3.0,3.0
374,Introduction to CSS3,https://www.coursera.org/learn/introcss,7,5,34,42.857142857142854,0.49757637168679913,7.0,3.0
374,Advanced Styling with Responsive Design,https://www.coursera.org/learn/responsivedesign,13,4,28,53.84615384615385,0.521299480360288,13.0,7.0
374,Introduction to HTML5,https://www.coursera.org/learn/html,9,3,24,55.55555555555556,0.4695032427708308,9.0,5.0
374,Interactivity with JavaScript,https://www.coursera.org/learn/javascript,8,4,21,25.0,0.4120636373758316,8.0,2.0
374,Web Design for Everybody Capstone,https://www.coursera.org/learn/web-design-project,2,6,25,50.0,0.5442992597818375,2.0,1.0
375,The Softer Side of Science Communication,https://www.coursera.org/learn/the-softer-side-of-science-communication,4,4,16,100.0,0.790375143289566,4.0,4.0
375,The Harder Side of Science Communication ,https://www.coursera.org/learn/the-harder-side-of-science-communication,4,4,13,100.0,0.678854326158762,4.0,4.0
375,Modes of Science Communication,https://www.coursera.org/learn/modes-of-science-communication,2,4,15,50.0,0.5280464574694633,2.0,1.0
376,Securing and Monitoring AWS Infrastructure,https://www.coursera.org/learn/securing-and-monitoring-aws-infrastructure,4,5,85,100.0,0.7045620292425155,4.0,4.0
376,AWS Cloud Essentials,https://www.coursera.org/learn/aws-cloud-essentials,1,5,59,100.0,0.6646528244018555,1.0,1.0
376,Migrating to AWS Cloud,https://www.coursera.org/learn/migrating-to-aws-cloud,4,5,65,100.0,0.787430589646101,4.0,4.0
376,AWS Cloud for Data and Database Migration,https://www.coursera.org/learn/aws-cloud-for-data-and-database-migration,4,5,63,100.0,0.7360736064612865,4.0,4.0
377,Advanced Models for Decision Making,https://www.coursera.org/learn/advanced-models-for-decision-making,13,4,46,69.23076923076923,0.5429846930962342,13.0,9.0
377,Optimization for Decision Making,https://www.coursera.org/learn/optimization-for-decision-making,7,4,39,42.857142857142854,0.46799590417316983,7.0,3.0
377,Introduction to Predictive Modeling,https://www.coursera.org/learn/introduction-to-predictive-modeling,5,4,49,20.0,0.4449372726678848,5.0,1.0
377,Simulation Models for Decision Making,https://www.coursera.org/learn/simulation-models-for-decision-making,13,4,60,38.46153846153847,0.49678042232990255,13.0,5.0
378,CPS solution for Industries,https://www.coursera.org/learn/cps-solution-for-industries,14,4,64,78.57142857142857,0.5492608591914176,14.0,11.0
378,"Industry 4.0: PLM, Value Chain, and Smart Factory",https://www.coursera.org/learn/industry-4-plm-value-chain-and-smart-factory,17,3,40,58.82352941176471,0.553549151210224,17.0,10.0
378,Digital Manufacturing: Introduction and Smart Design,https://www.coursera.org/learn/digital-technology-and-smart-design-for-manufacturing,16,3,54,75.0,0.6063282717019319,16.0,12.0
379,Performance Monitoring For Application Developers,https://www.coursera.org/learn/codio-performance-monitoring,3,3,12,100.0,0.6407321612040202,3.0,3.0
379,Mastering Ansible Automation,https://www.coursera.org/learn/mastering-ansible-automation,2,3,12,50.0,0.47792436629533763,2.0,1.0
379,Container Creation and Orchestration Basics,https://www.coursera.org/learn/codio-container-creation-and-orchestration-basics,3,3,6,100.0,0.6676695277293523,3.0,3.0
379,Introduction to Terraform,https://www.coursera.org/learn/codio-terraform,2,3,12,100.0,0.8320081532001495,2.0,2.0
379,CI/CD for Software Developers,https://www.coursera.org/learn/codio-cicd-for-software-developers,3,3,11,100.0,0.6453653097152711,3.0,3.0
380,Advanced IoT Systems Integration and Industrial Applications,https://www.coursera.org/learn/advanced-iot-systems-and-industrial-applications-course-3,11,3,25,81.81818181818183,0.5469963206486268,11.0,9.0
380,Design Thinking for Human-Centered IoT Solutions,https://www.coursera.org/learn/design-thinking-for-human-centered-iot-solutions-course-2,12,4,30,91.66666666666666,0.6735590646664301,12.0,11.0
380,Foundations of IoT Systems and Industrial Automation,https://www.coursera.org/learn/iot-systems-and-industrial-automation-course-1,10,3,28,80.0,0.5712511758506298,10.0,8.0
381,Microservices and Deployment by using ASP.NET,https://www.coursera.org/learn/microservices-and-deployment-by-using-aspnet,4,3,46,100.0,0.6657461039721966,4.0,4.0
381,Advanced Concepts in React Native Development,https://www.coursera.org/learn/advanced-concepts-in-react-native-development,4,3,27,50.0,0.44160130713135004,4.0,2.0
381,Cross Platform Mobile Development with React Native,https://www.coursera.org/learn/v2-cross-platform-mobile-development-with-react-native,4,3,34,75.0,0.6063554435968399,4.0,3.0
382,Privacy in Europe,https://www.coursera.org/learn/privacy-eu,4,7,48,75.0,0.5816149920225143,4.0,3.0
382,Privacy in the USA,https://www.coursera.org/learn/privacy-laws-us,4,7,30,75.0,0.5587367702275514,4.0,3.0
382,Privacy & Standardisation Capstone,https://www.coursera.org/learn/privacy-capstone,4,6,41,100.0,0.6026574306190013,4.0,4.0
382,Privacy in the Western World,https://www.coursera.org/learn/history-privacy-laws,1,8,29,0.0,0.4907904535531997,1.0,0.0
382,Standardisation & Technology,https://www.coursera.org/learn/standardisation,6,6,29,66.66666666666666,0.5680158702035746,6.0,4.0
383,Introduction to Privacy - Part 1,https://www.coursera.org/learn/introduction-to-privacy---part-1,3,4,14,100.0,0.641898512840271,3.0,3.0
383,Introduction to Privacy - Part 2,https://www.coursera.org/learn/introduction-to-privacy---part-2,3,4,13,66.66666666666666,0.5585987210273742,3.0,2.0
383,Fundamental Privacy Acts and Laws,https://www.coursera.org/learn/fundamental-privacy-acts-and-laws,3,3,15,100.0,0.718856261173884,3.0,3.0
383,Introduction to Privacy - Part 3,https://www.coursera.org/learn/introduction-to-privacy---part-3,3,3,10,33.33333333333333,0.4890697697798411,3.0,1.0
384,Fundamentals of Product Management,https://www.coursera.org/learn/fundamentals-of-product-management,3,3,56,100.0,0.7330241690079372,3.0,3.0
384,Strategic Product Management,https://www.coursera.org/learn/strategic-product-management,3,4,71,100.0,0.7239175200462341,3.0,3.0
384,Product Manager's Interview Playbook: Strategies for Success,https://www.coursera.org/learn/product-managers-interview-playbook-strategies-for-success,3,3,51,100.0,0.6890847484270731,3.0,3.0
385,Natural Disaster Risk in Infrastructure Projects,https://www.coursera.org/learn/natural-disaster-risk-in-infrastructure-projects,3,2,5,66.66666666666666,0.6718857566515605,3.0,2.0
385,Decision Making and Governance of Natural Disaster Risk,https://www.coursera.org/learn/decision-making-and-governance-of-natural-disaster-risk,3,2,6,66.66666666666666,0.5551146691044172,3.0,2.0
385,Qualitative and Quantitative Analysis of Disaster Risk,https://www.coursera.org/learn/qualitative-and-quantitative-analysis-of-disaster-risk,3,2,14,100.0,0.7907798886299133,3.0,3.0
386,Advanced Exploitation and Scripting Techniques,https://www.coursera.org/learn/packt-advanced-exploitation-and-scripting-techniques-edpee,4,5,57,50.0,0.5666161760687828,4.0,2.0
386,Ethical Hacking Foundations,https://www.coursera.org/learn/packt-ethical-hacking-foundations-cacdd,4,5,18,100.0,0.6471853464841842,4.0,4.0
386,Intermediate Ethical Hacking Techniques,https://www.coursera.org/learn/packt-intermediate-ethical-haking-techniques-1yazc,4,4,67,50.0,0.5618027593940497,4.0,2.0
387,Unleashing the Impact of your Social Enterprise,https://www.coursera.org/learn/social-impact-growth,11,5,28,54.54545454545454,0.5321407626975666,11.0,6.0
387,Social Business Model and Planning for Social Innovation,https://www.coursera.org/learn/social-business-model,7,5,35,71.42857142857143,0.5888484716415405,7.0,5.0
387,Identifying Social Entrepreneurship Opportunities,https://www.coursera.org/learn/social-entrepreneurship-opportunities,5,5,35,80.0,0.6119464039802551,5.0,4.0
388,Building R Packages,https://www.coursera.org/learn/r-packages,1,4,8,0.0,0.4203379154205322,1.0,0.0
388,The R Programming Environment,https://www.coursera.org/learn/r-programming-environment,2,7,15,50.0,0.5322840258479118,2.0,1.0
388,Building Data Visualization Tools,https://www.coursera.org/learn/r-data-visualization,1,5,13,100.0,0.7959355056285857,1.0,1.0
388,Mastering Software Development in R Capstone,https://www.coursera.org/learn/r-capstone,2,6,13,50.0,0.511554941534996,2.0,1.0
388,Advanced R Programming,https://www.coursera.org/learn/advanced-r,1,7,24,100.0,0.5473528623580932,1.0,1.0
389,The History of Rocket Science,https://www.coursera.org/learn/history-of-rocket-science,3,4,21,100.0,0.6323212991158167,3.0,3.0
389,The Basics of Rocket Science,https://www.coursera.org/learn/basics-of-rocket-science,3,4,50,66.66666666666666,0.5824674348036448,3.0,2.0
389,Rocket Science in Everyday Life,https://www.coursera.org/learn/rocket-science-in-everyday-life,3,4,36,66.66666666666666,0.5507979293664296,3.0,2.0
390,The Total Data Quality Framework,https://www.coursera.org/learn/the-total-data-quality-framework,4,4,43,100.0,0.7449414141476154,4.0,4.0
390,Measuring Total Data Quality,https://www.coursera.org/learn/measuring-total-data-quality,3,4,29,100.0,0.65662702023983,3.0,3.0
390,Design Strategies for Maximizing Total Data Quality,https://www.coursera.org/learn/design-strategies-for-maximizing-total-data-quality,3,4,28,33.33333333333333,0.49681012829144794,3.0,1.0
391,Introduction to Archaeology: Archaeology as Activism,https://www.coursera.org/learn/archaeology-as-activism,7,6,33,71.42857142857143,0.6047429531812668,7.0,5.0
391,Introduction to Archaeology : Archaeology as Science,https://www.coursera.org/learn/archaeology-as-science,6,7,40,83.33333333333334,0.5982540835936864,6.0,5.0
391,Introduction to Archaeology: Reconstruction of The Past,https://www.coursera.org/learn/knowing-the-past-archaeology-as-reconstruction-of-the-past,7,7,38,85.71428571428571,0.6803326102239744,7.0,6.0
391,Introduction to Archaeology: Knowing The Past,https://www.coursera.org/learn/introduction-to-knowing-the-past,4,4,19,75.0,0.6331496767699718,4.0,3.0
392,IoT Networking,https://www.coursera.org/learn/iot-networking,2,4,24,100.0,0.639187042415142,2.0,2.0
392,IoT Communications,https://www.coursera.org/learn/iot-communications,4,4,31,75.0,0.5060500048100948,4.0,3.0
392,IoT Cloud,https://www.coursera.org/learn/iot-cloud,10,4,19,40.0,0.40551092647016046,10.0,4.0
392,IoT Devices,https://www.coursera.org/learn/iot-devices-il,9,4,28,44.44444444444444,0.4755564312140146,9.0,4.0
393,Deep Excavations and Support Systems ,https://www.coursera.org/learn/deep-excavations-and-support-system,3,4,48,100.0,0.6913374265034994,3.0,3.0
393,Tunnel Construction Practices ,https://www.coursera.org/learn/tunnel-construction-practices,8,5,41,75.0,0.6026550788432359,8.0,6.0
393,Underground Metros Shafts and Caverns ,https://www.coursera.org/learn/underground-metros-shafts-and-caverns,7,6,56,71.42857142857143,0.588901971067701,7.0,5.0
394,Linux System Administration with IBM Power Systems,https://www.coursera.org/learn/linux-system-administration-ibm-power-systems,13,12,92,82.35294117647058,0.6200776854858678,17.0,14.0
394,Private Cloud Management on IBM Power Systems,https://www.coursera.org/learn/private-cloud-ibm-power-systems,3,10,82,62.5,0.5384768703021109,16.0,10.0
394,Fundamentals of Red Hat Enterprise Linux 9,https://www.coursera.org/learn/fundamentals-of-red-hat-enterprise-linux-9,4,12,28,100.0,0.8417743444442749,4.0,4.0
395,"Anthropometry, Biomechanics, and Motor Skills in User Design",https://www.coursera.org/learn/anthropometry-biomechanics-and-motorskills-in-user-design,1,5,17,100.0,0.6169110834598541,1.0,1.0
395,Human Cognitive Capacities & Limitations,https://www.coursera.org/learn/human-cognitive-capacities-and-limitations,1,5,17,100.0,0.8263804137706756,1.0,1.0
395,How Can We Measure and Study Human Error?,https://www.coursera.org/learn/how-can-we-measure-and-study-human-error,1,5,15,100.0,0.6583210825920105,1.0,1.0
395,What is the Human Factor in Design?,https://www.coursera.org/learn/what-is-the-human-factor-in-design,1,5,14,100.0,0.7111875593662261,1.0,1.0
395,The Limits of Human Perception,https://www.coursera.org/learn/the-limits-of-human-perception,1,5,18,100.0,0.8509671688079834,1.0,1.0
396,Logistic Regression and Prediction for Health Data,https://www.coursera.org/learn/logistic-regression-prediction-health-data,3,3,38,100.0,0.6469551006952922,3.0,3.0
396,Arranging and Visualizing Data in R ,https://www.coursera.org/learn/arranging-visualizing-data-r,4,4,48,75.0,0.5284285802394152,4.0,3.0
396,Linear Regression Modeling for Health Data,https://www.coursera.org/learn/linear-regression-modeling-health-data,3,3,32,100.0,0.6412281195322672,3.0,3.0
397,Artificial Intelligence Privacy and Convenience,https://www.coursera.org/learn/ai-privacy-and-convenience,6,3,14,0.0,0.36865225732326506,6.0,0.0
397,Artificial Intelligence Data Fairness and Bias						,https://www.coursera.org/learn/ai-data-bias,6,3,15,16.666666666666664,0.3727809074024359,6.0,1.0
397,Artificial Intelligence Algorithms Models and Limitations,https://www.coursera.org/learn/ai-algorithm-limitations,7,4,15,42.857142857142854,0.49945475693259916,7.0,3.0
397,Artificial Intelligence Ethics in Action,https://www.coursera.org/learn/ai-ethics-analysis,5,4,9,0.0,0.33385366886854173,5.0,0.0
398,"American Politics, Society, and History",https://www.coursera.org/learn/american-politics-society-and-history-mooc,3,5,46,33.33333333333333,0.44391142676273976,3.0,1.0
398,"India-US Relations: Geopolitics, Culture, and Business",https://www.coursera.org/learn/india-us-relations-geopolitics-culture-and-business-mooc,4,5,45,75.0,0.5299717292189597,4.0,3.0
398,The Making of US Foreign Policy,https://www.coursera.org/learn/the-making-of-us-foreign-policy-mooc,3,5,51,66.66666666666666,0.5344451208909352,3.0,2.0
399,Data Analytics and Databases on AWS,https://www.coursera.org/learn/data-analytics-and-databases-aws,3,3,24,66.66666666666666,0.6423081318537394,3.0,2.0
399,Developing Applications in Python on AWS,https://www.coursera.org/learn/developing-applications-in-python-on-aws,2,4,31,50.0,0.5611662179231643,2.0,1.0
399,Providing Technical Support for AWS Workloads,https://www.coursera.org/learn/technical-support-for-aws-workloads,2,3,27,0.0,0.4636112734675407,2.0,0.0
399,Skills for Working as an AWS Cloud Consultant,https://www.coursera.org/learn/aws-cloud-consultant-skills,2,4,27,50.0,0.5142714083194733,2.0,1.0
399,DevOps on AWS and Project Management,https://www.coursera.org/learn/devops-and-project-management-aws,19,4,31,73.68421052631578,0.6514974757244713,19.0,14.0
399,Introduction to Information Technology and AWS Cloud,https://www.coursera.org/learn/information-technology-and-aws,2,3,29,50.0,0.6035710796713829,2.0,1.0
399,Capstone: Following the AWS Well Architected Framework,https://www.coursera.org/learn/aws-well-architected-framework,10,3,26,100.0,0.7515173396468162,10.0,10.0
399,AWS Cloud Technical Essentials,https://www.coursera.org/learn/aws-cloud-technical-essentials,22,16,224,82.35294117647058,0.6569410079104058,34.0,28.0
399,Automation in the AWS Cloud,https://www.coursera.org/learn/automation-in-aws,10,3,25,90.0,0.5800118046998978,10.0,9.0
400,Introduction to Web Applications,https://www.coursera.org/learn/akamai-web-apps,1,16,110,0.0,0.4954375028610229,2.0,0.0
400,Managing Relational Databases,https://www.coursera.org/learn/akamai-databases,1,21,162,100.0,0.6856808662414551,3.0,3.0
400,Introduction to IT Security,https://www.coursera.org/learn/akamai-security,1,27,207,100.0,0.6803961992263794,3.0,3.0
400,Networking Fundamentals,https://www.coursera.org/learn/akamai-networking,19,27,177,89.47368421052632,0.6501562755358847,57.0,51.0
400,Operating Systems Fundamentals,https://www.coursera.org/learn/akamai-operating-systems,1,27,243,100.0,0.6486600637435913,3.0,3.0
400,Python Scripting Fundamentals,https://www.coursera.org/learn/akamai-programming,1,21,147,100.0,0.59320467710495,3.0,3.0
401,Teach English Now! Theories of Second Language Acquisition,https://www.coursera.org/learn/language-theories,5,12,74,20.0,0.424380062520504,10.0,2.0
401,Teach English Now! Lesson Design and Assessment,https://www.coursera.org/learn/lesson-design,4,12,60,50.0,0.47619557306170457,8.0,4.0
401,"Teach English Now! Second Language Reading, Writing, and Grammar ",https://www.coursera.org/learn/tesol-writing,1,12,68,100.0,0.5423228740692139,2.0,2.0
